{
  "schema_version": "city2.producer-contract/v1",
  "contract_id": "m6-candidate",
  "contract_version": 1,
  "producer_id": "pending-live-selection",
  "host_id": "worker-1",
  "unix_user": "pending-live-selection",
  "agent_id": "agt_01980000-0000-7000-8000-000000000006",
  "source": {
    "uri": "file:///replace-before-enable/output.json",
    "media_type": "application/json",
    "access": "read-only",
    "max_bytes": 104857600
  },
  "authorities": {
    "schedule": "external-unchanged",
    "database": "external-unchanged",
    "source_write": "denied"
  },
  "memory_scope": "project:city2",
  "sensitivity": "internal",
  "freshness_slo_seconds": 108000,
  "value_metrics": ["signed_provenance", "freshness_detection"],
  "rollback": {
    "disable_action": "remove-observer",
    "downstream_dependencies": []
  },
  "enabled": false
}
